article_title,article_link,article_content
"GM to release plug-in hybrid vehicles, backtracking on product plans",https://www.cnbc.com/2024/01/30/gm-to-release-plug-in-hybrid-vehicles-backtracking-on-product-plans.html,"DETROIT – General Motors is changing its product lineup strategy to include plug-in hybrid electric vehicles, CEO Mary Barra told investors Tuesday.Barra did not disclose specific details of the plans other than that PHEVs, which include an internal combustion engine along with battery technologies, will be rolled out on ""select vehicles"" in North America to assist in meeting more stringent federal fuel economy regulations.More companies are reconsidering the viability of hybrid vehicles to appease consumer demand and avoid costly penalties related to those federal fuel economy and emissions standards. Most of GM's main competitors offer traditional hybrids as well as plug-in hybrid electric vehicles.""Let me be clear, GM remains committed to eliminating tailpipe emissions from our light-duty vehicles by 2035, but, in the interim, deploying plug-in technology in strategic segments will deliver some of the environment or environmental benefits of EVs as the nation continues to build this charging infrastructure,"" Barra said during the automaker's quarterly and 2023 earnings call.Barra alluded to the automaker using plug-in hybrid technology that the company has already adopted overseas in countries such as China. The only hybrid GM currently offers in the U.S. is a traditional hybrid version of the Chevrolet Corvette.GM led the way for plug-in electric vehicles with the Chevrolet Volt during the 2010s. The company discontinued the vehicle in early 2019, citing demand and cost concerns.The Detroit automaker previously planned to forgo plug-in hybrid vehicles and move all of its traditional cars and trucks with internal combustion engines to all-electric models for consumers.The shifting strategies are counterintuitive to the industry's recent messaging on EVs. Many auto companies have begun to invest billions of dollars in all-electric vehicles, and the Biden administration has made a push to get more EVs on U.S. roadways as quickly as possible.Don't miss these stories from CNBC PRO:"
Home prices began to cool in November after nine straight months of gains,https://www.cnbc.com/2024/01/30/home-prices-november-sp-case-shiller.html,"Home prices in November fell 0.2% from October, according to the S&P CoreLogic Case-Shiller national home price index.While that may not seem like a lot, it is the first monthly drop since January 2023. Mortgage rates rose sharply in October to their highest level in more than 20 years, making houses hard to afford.Seattle and San Francisco reported the largest monthly price declines, falling 1.4% and 1.3%, respectively. Meanwhile, six cities registered a new all-time high in November. Those were Miami; Tampa, Florida; Atlanta; Charlotte, North Carolina; New York; and Cleveland.Prices nationally were still higher than the year before, and those annual gains increased again relative to the prior month. They rose 5.1% from November 2022, up from a 4.7% annual increase in October. The 10-city composite climbed 6.2%, up from a 5.7% advance in October. The 20-city composite rose 5.4%, up from a 4.9% increase in the previous month.""The house price decline came at a time where mortgage rates peaked, with the average Freddie Mac 30-year fixed rate mortgage nearing 8%, according to Federal Reserve data,"" said Brian Luke, head of commodities, real and digital assets at S&P DJI. ""The rate has since fallen over 1%, which could support further annual gains in home prices.""For the second straight month, Detroit reported the highest year-over-year gain among the 20 cities. Prices rose 8.2% in November, followed again by San Diego with an 8% increase.Portland, Oregon, was the only city showing prices lower from the prior year, down 0.7%, compared with November 2022.Regionally, the November report showed the narrowest price performance spread across the country since the first part of 2021.""The tight disparity speaks to a rising tide across the country, with less evidence of micro-markets bucking the trend. The days of markets in the South rising double digits with markets in the Midwest remaining flat are over,"" added Luke.Don't miss these stories from CNBC PRO:"
Pfizer beats on earnings as Covid business loses less revenue than expected,https://www.cnbc.com/2024/01/30/pfizer-pfe-q4-earnings-report-2023.html,"Pfizer on Tuesday posted a surprise adjusted fourth-quarter profit, as the company's declining Covid business loss less revenue than expected.The company reversed roughly $3.5 billion in revenue related to the expected return of 6.5 million doses of its Covid drug, Paxlovid, from the U.S. government. That hit is less than the $4.2 billion Pfizer initially expected for the return of nearly eight million doses of Paxlovid.The company sees the fewer-than-expected returned Paxlovid doses as an ""encouraging sign"" because it indicates that use of the drug increased in the fourth quarter, Pfizer Chief Financial Officer Dave Denton told CNBC in an interview.Pfizer's Covid vaccine raked in $5.36 billion in revenue for the quarter, down 53% from the same period last year. Analysts had expected the shot to bring in $4.99 billion in sales, according to FactSet estimates.Pfizer CEO Albert Bourla told CNBC around 15% of the U.S. population received an updated Covid vaccine this fall and winter. That's slightly lower than the 17% Pfizer forecast in October, a month after the company's new shot rolled out.The results come as Pfizer tries to blunt the rapid decline of its Covid business, which saw demand plummet to new lows and transitioned to the commercial market in the U.S. last year. As revenue suffers, the company is trying to improve its bottom line and boost investor confidence through a broad $4 billion cost-cutting plan.Here's what Pfizer reported for the fourth quarter compared to what Wall Street was expecting, based on a survey of analysts by LSEG, formerly known as Refinitiv:The pharmaceutical giant also reiterated its full-year 2024 guidance, which it first outlined in mid-December.Pfizer expects revenue to come in between $58.5 billion and $61.5 billion this year, which includes roughly $8 billion in revenue from its Covid products and contributions from its recently closed acquisition of cancer drug developer Seagen.The company expects to book adjusted earnings of $2.05 to $2.25 per share.Pfizer recorded fourth-quarter revenue of $14.25 billion, down 41% from the same period a year ago, due to the plunge in sales of its Covid products.For the fourth quarter, Pfizer booked a net loss of $3.37 billion, or 60 cents per share. That compares to a net income of $4.99 billion, or 87 cents per share, during the same period a year ago.Excluding certain items, the company posted earnings per share of 10 cents for the quarter. Still, Pfizer's Covid business had a dismal 2023.Revenue from its Covid vaccine and Paxlovid came in at $12.5 billion in 2023. That's down 78% from their $57 billion peak in 2022."
"GM beats Wall Street estimates, forecasts continued strong profit in 2024",https://www.cnbc.com/2024/01/30/general-motors-gm-earnings-q4-2023.html,"DETROIT — General Motors beat Wall Street's top- and bottom-line expectations for the fourth quarter, while forecasting another strong year despite potential economic and sales head winds.The Detroit automaker's 2024 guidance calls for net income attributable to stockholders of $9.8 billion to $11.2 billion, or $8.50 to $9.50 earnings per share; adjusted earnings before interest and taxes (EBIT) of $12 billion to $14 billion, or $8.50 to $9.50 adjusted EPS; and adjusted automotive free cash flow between $8 billion and $10 billion.The earnings guidance is largely better than GM's 2023 results and in line or higher than many Wall Street analysts' expectations of flat results compared with 2023.Shares of GM on Tuesday were up more than 8% during early trading Tuesday.Here's how the company performed in the fourth quarter, compared with average estimates compiled by LSEG, formerly known as Refinitiv:For the fourth quarter, GM reported net income for stockholders of $2.1 billion, or $1.59 per share, compared with $2 billion, or $1.39 per share a year earlier. Adjusting for one-time items, GM earned $1.24 per share, topping Wall Street expectations.Revenue was largely flat year over year, at $42.98 billion compared with $43.11 billion for the final three months of 2022.GM's full-year 2023 revenue was about up 10% compared with the prior year, at $171.84 billion, with net income attributable to stockholders of $10.13 billion and adjusted earnings before interest and taxes of $12.36 billion. That compares with 2022 revenue of $156.74 billion, net income attributable to stockholders of $9.93 billion and adjusted EBIT of $14.47 billion.""As we begin 2024, I believe GM is well positioned for another year of strong financial performance,"" GM CFO Paul Jacobson told the media during a call to discuss the results.GM's 2023 earnings included several special charges, including $1.1 billion in North American strike costs and $792 million for new commercial agreements between GM and LG Electronics and LG Energy Solution.Shares of GM are down less than 2% this year after rising about 7% last year, lifted by an accelerated $10 billion share repurchase program that was announced in late November."
"JetBlue swings to a loss, forecasts lower capacity in 2024",https://www.cnbc.com/2024/01/30/jetblue-airways-jblu-earnings-q4-2023.html,"JetBlue Airways swung to a loss in the fourth quarter and forecast lower capacity this year as it scrambles to return to profitability.The airline expects revenue to drop between 5% and 9% in the first three months of the year, more than the 5.5% decline Wall Street analysts were predicting. Capacity in the first quarter will be down as much as 6%, the airline said.JetBlue said it expects 2024 capacity to be down in the low single digits and that its adjusted margins could approach breakeven. Its shares fell 4.7% Tuesday.In an investor presentation, JetBlue said it has seven Airbus jets out of service for engine inspections stemming from a production problem at manufacturer Pratt & Whitney, a unit of RTX. It said that number could rise to as much as 15 by the end of the year.The airline has been grappling with higher costs, operational challenges and changing travel patterns, just as a federal judge earlier this month barred its plan to acquire Spirit Airlines for $3.8 billion. JetBlue warned last week the agreement with Spirit could be terminated, but it didn't provide further detail on Tuesday. JetBlue is also offering buyouts to some salaried workers to cut costs.The New York-based carrier said Tuesday it plans to defer $2.5 billion in spending on new aircraft until the end of the decade. Joanna Geraghty, JetBlue's COO and incoming chief executive, declined to say on the call whether Airbus provided JetBlue incentives to defer aircraft as other carriers scramble for new jets. Reuters reported earlier this week that United Airlines is seeking Airbus A321neo planes, which JetBlue also has on order, after expressing frustration about production problems at Boeing.Geraghty, however, said on the earnings call: ""I do believe that this was a win-win for both [Airbus] and ourselves over the next few years.""Here's what JetBlue reported for the fourth quarter, compared with Wall Street expectations complied by LSEG, formerly known as Refinitiv:The New York-based airline reported a net loss of $104 million for the last three months of 2023, compared with a $24 million profit a year earlier. On a per-share basis, JetBlue lost 31 cents during the fourth quarter, or 19 cents on an adjusted basis, compared with a 7-cent profit during the year-earlier period.Revenue for the fourth quarter was down 3.7% year over year, though still slightly ahead of Wall Street estimates.JetBlue has been tweaking its network to focus on more profitable flights. CNBC reported JetBlue's planned flight cuts earlier this month.""Demand during peak periods remains strong, and we continue to manage our capacity during off-peak periods to reflect evolving demand trends,"" said Geraghty said in the earnings release. ""We plan to continue to refine our network and product offering to better serve our leisure customers while diversifying revenues with margin-accretive initiatives.""Other airlines including Southwest have also slowed their growth or refined their networks to avoid overcapacity — and low fares — during off-peak periods, while discounting less popular flights.Don't miss these stories from CNBC PRO:"
Tom Brady is merging his nutrition and apparel brands with Nobull,https://www.cnbc.com/2024/01/30/tom-brady-nutrition-apparel-brands-merging-with-nobull.html,"Seven-time Super Bowl Champion Tom Brady is merging his health and nutrition company, TB12, and his apparel company, Brady, with training brand Nobull.As part of the deal, Brady will become the No. 2 shareholder in Nobull, behind BodyArmor founder Mike Repole who bought the company last year.Terms of the deal were not provided.Nobull was founded in 2015 by former Reebok executives Marcus Wilson and Michael Schaeffer. The Boston-based company employs about 100 people across the U.S., U.K. and China, and sells its sneakers and apparel primarily online.Under the merger, the company will continue to operate under the brand name Nobull and aims to become a complete wellness company.""I wanted to do something really big,"" Repole said about the deal with Brady. ""I think Nobull has a chance here to be this epic historic brand — playing in a space of health and wellness, through sneakers, apparel, nutrition mentality and really helping people with adversity, resilience, grit."""
Retail return fraud is rising as consumers send back purchases in droves,https://www.cnbc.com/2024/01/29/retail-return-fraud-is-rising-as-key-holiday-deadline-approaches.html,"As retailers tried to win shoppers and boost sales in recent years, they made their online return policies more lenient than ever.But those changes have come at a cost.As more consumers shop online and send back more of those orders, retailers have moved to crack down on fraud. In some cases, shoppers can send back different items than the ones they bought, return stolen items or claim a purchase never got delivered when it really did.Retailers estimate 13.7% of returns, or $101 billion worth, were fraudulent last year, according to a survey by Appriss Retail and the National Retail Federation. The share of returns expected to be fraudulent during the peak holiday season was even higher at 16.5%, or $24.5 billion worth, the survey found."
"FanDuel parent Flutter lists on NYSE, challenging DraftKings in sports betting",https://www.cnbc.com/2024/01/29/fanduel-parent-flutter-lists-on-the-nyse.html,"FanDuel parent Flutter listed on the New York Stock Exchange on Monday, offering U.S. investors an alternative to the biggest pure play in sports betting, DraftKings.It's a secondary listing for the international sportsbook, which will retain its primary listing on the London Stock Exchange and inclusion in the FTSE 100 index.But Flutter's most important market for revenue and growth is the United States, where FanDuel is the market share leader. In the fourth quarter, FanDuel had 43% market share based on gross revenue and 51% based on net revenue."
Starbucks olive oil-infused Oleato drinks to launch across the U.S.,https://www.cnbc.com/2024/01/29/starbucks-oleato-olive-oil-drinks-launch-across-the-us.html,"Starbucks is launching its olive oil-infused drinks in all U.S. stores beginning Tuesday, the company said.The beverages, named Oleato, debuted in Italy in February 2023 after former CEO Howard Schultz visited the country and noticed locals drinking olive oil daily. The line of olive oil-infused coffee drinks launched the next month in select U.S. Starbucks stores and met negative early reviews, with The New Yorker saying the drink ""tasted like a large spoonful of olive oil in coffee.""Oleato means ""with oil"" in Italian, according to Starbucks. The line includes a latte and an iced espresso drink.It also features the Oleato Golden Foam, which the company said is a vanilla sweet cream infused with Partanna extra virgin olive oil that can be added to any Starbucks drink. Four recommended customizations for the foam will also be available in the app, Starbucks added.The launch comes on the same day Starbucks will report fourth-quarter earnings.The company is trying to sustain sales growth in its North America unit. Its shares have fallen more than 3% so far this year.Don't miss these stories from CNBC PRO:"
Big pharma is preparing to lose revenue from blockbuster drugs,https://www.cnbc.com/2024/01/28/big-pharma-merck-bristol-myers-jj-prepare-to-lose-revenue.html,"Big pharmaceutical companies such as Bristol Myers Squibb, Merck and Johnson & Johnson face a looming threat that will put tens of billions of dollars in sales at risk between now and 2030, as blockbuster drugs will tumble off a so-called patent cliff.That refers to when a company's patents for one or more leading branded products expire, which opens the door for competitors to sell copycats of those drugs, often at a lower price. That typically causes revenue to fall for drugmakers and costs to drop for patients, who can access more affordable options.Certain drugmakers appear well prepared to offset some losses from upcoming patent cliffs, as they build their drug pipelines and ink acquisitions or partnerships with other companies, some Wall Street analysts said.Patent cliffs are an unavoidable issue for pharmaceutical companies. They must replenish older top-selling drugs with new ones that they hope will not just sustain their sales, but also grow them.The loss of exclusive rights on a drug can affect companies differently, depending on how much of their sales they get from the product or what type of treatment it is. Some drugs facing patent expirations will also be subject to the Biden administration's Medicare drug price negotiations, a policy that may further threaten the companies' revenues.The top 20 biopharma companies have $180 billion in sales at risk from patent expirations between now and 2028, according to estimates from EY.""It does differ by company at this stage, and I think there are a number of products in the '25, '30 timeframe that will be major growth drivers for large biopharma companies … but all in all, there are plenty of companies that have revenue holes to plug,"" William Blair & Company analyst Matt Phipps told CNBC."
Why kids TV content is vital to streaming subscriber growth,https://www.cnbc.com/2024/01/27/kids-streaming-content-vital-to-subscriber-growth.html,"""Tinky Winky. Dipsy. Laa-Laa. Po!""Those four names, the iconic sing-song intro to the ""The Teletubbies,"" have graced household TVs for nearly 30 years. While the library of episodes hasn't changed in decades, their role in American media has taken on new meaning in the age of streaming.""Back in the day TV was a little simpler,"" said Dean Koocher a television expert, who spent years bringing international kids shows, including ""Teletubbies"" and ""The Wiggles,"" to the Americas.""Back then there were less gatekeepers, you know, there was PBS, Disney and Nickelodeon was kind of an upstart coming up,"" Koocher told CNBC. ""The good thing was, if you ever could get their eyeballs, you had a much bigger piece of the market, because there weren't that many choices for kids.""Now, shows aren't just on traditional TV and there are far more places for parents and kids to find content. From YouTube and TikTok to dozens of streaming options, audiences don't need to wait to watch their favorite shows. Saturday morning cartoons are now everyday-anytime cartoons.And that's good for streamers, too, especially as Wall Street profitability pressures mount.Kids represent a unique demographic for the entertainment industry. Age-specific advertising laws mean companies can't market directly to them in many cases, but their viewing habits — often favoring repetition of content — makes them exceptionally loyal consumers.At a time when streaming services are eager to lure in new subscribers and decrease churn, having a hub for family-friendly content is one way to ensure paying members (i.e. parents) stick around.""Kids and family-friendly content is critically important to both streaming acquisition and retention,"" said Peter Csathy, founder and chair of advisory firm Creative Media. ""Franchise family-friendly brands are welcomed by exhausted parents looking for some down time as their kids get their screen time.""Once those kids are hooked on a show, they never leave and will not let their parents even think of leaving,"" he added.That's vitally important for streaming services, especially as consumers grow more cost-conscious and weigh which services to keep month after month and which services to ditch before the next billing cycle.In recent years, legacy media companies — like Disney, Warner Bros. Discovery, Universal and Paramount — have scrambled to compete with Netflix in the streaming realm. For a while, Wall Street was satisfied with high subscriber growth and the promise of profitability in the future. However, as ad revenue from linear TV continued to decline significantly, investors quickly reversed course, demanding more immediate earnings growth."
WWE founder Vince McMahon resigns from TKO Group after sexual assault allegation,https://www.cnbc.com/2024/01/26/wwe-founder-vince-mcmahon-resigns-from-tko-group-after-being-accused-of-sexual-assault-and-trafficking-in-new-lawsuit.html,"Vince McMahon, executive chairman of the board of TKO Group Holdings and founder of wrestling giant WWE, has resigned his positions at both companies, according to a WWE memo obtained by CNBC and confirmed by the company.""Vince McMahon has tendered his resignation from his positions as TKO Executive Chairman and on the TKO Board of Directors. He will no longer have a role with TKO Group Holdings or WWE,"" said Nick Khan, president of the WWE.The announcement came in the wake of allegations made public Thursday, of sexual assault and sex trafficking, against McMahon.McMahon has denied the allegations. But he said in a statement late Friday that, ""out of respect for the WWE Universe, the extraordinary TKO business and its board members and shareholders, partners and constituents, and all of the employees and Superstars who helped make WWE into the global leader it is today, I have decided to resign from my executive chairmanship and the TKO board of directors, effective immediately.""The latest allegations against McMahon were in a lawsuit filed by Janel Grant — who alleges McMahon directed her to have sex with a WWE ""superstar"" and other men. Grant's suit seeks to void a nondisclosure agreement Grant said she reached with McMahon in early 2022.Grant's suit in U.S. District Court in Connecticut says the billionaire McMahon agreed to pay her $3 million as part of that deal, but ended up only paying her $1 million in exchange for her silence about his conduct.In addition to McMahon, 78, the complaint names as defendants WWE and John Laurinaitis, the company's former head of talent relations and general manager.The complaint comes six months after federal law enforcement agents executed a search warrant on McMahon and served him with a grand jury subpoena as part of an investigation into McMahon's payment of millions of dollars to multiple women, among them Grant, after allegations of sexual misconduct.McMahon, who resigned from WWE leadership posts in mid-2022 amid an internal company investigation, only to return as its leader in early 2023, last March paid WWE $17.4 million to cover costs of a probe of those payouts by a law firm retained by the company."
A handful of space companies are running out of cash and time,https://www.cnbc.com/2024/01/27/three-space-companies-at-risk-of-running-out-of-cash.html,"The space sector's on the tail end of a boom-and-bust cycle. While many companies battened down the hatches to survive, a few publicly-traded names are running on fumes.A flurry of about a dozen space companies went public over the last few years. Although each have had fairly dismal stock performances since their debuts, the majority are still moving forward and look to build momentum in the year ahead, with some closing in on coveted profitability milestones.But a trio of names appear likely to go the way of Virgin Orbit, which flamed out last year. Here's who's most at risk of delisting, acquisition or even bankruptcy.Sign up here to receive weekly editions of CNBC's Investing in Space newsletter."
